title;text;Researchtitle;url;Language
Stoel;"Soms komt een goed idee zó bovendrijven
onder de douche – een droomscenario.
Maar meestal zit je achter een bureau
om urenlang te denken en te schrijven.

Je ondervindt dan zittend aan den lijve
de waarde van een stoel. Het risico
op klachten is vrij groot. Je animo
vermindert als je alles voelt verstijven.

Een goede stoel houdt kenniswerkers scherp.
Dynamisch moet hij zijn, met ondersteuning
en de perfecte zithoek voor de leuning.

Nu liggen er adviezen voor ontwerp:
voornaamst is dat je alles kunt verstellen.
Maar wie durft dat aan Rietveld te vertellen?";Seat design in the context of knowledge work;https://repository.tudelft.nl/islandora/object/uuid%3A19060a11-6d6c-46dd-9f47-8583d1610b94;NL
Doorbraak;"De mens bevecht het water. Ongelijk
is deze strijd. Wij dammen in, maar zie:
een dam kan veilig zijn in theorie;
hij barst in de weerbarstige praktijk.

Wanneer het water eenmaal door een dijk
of dam breekt, kennen Delftse technici
precies de natte choreografie
van water, aarde, zand, beton en slijk.

Hoe is zo’n vloed van invloed op gebouwen?
Dat kunnen we in een model beschouwen,
maar cruciaal is dat iemand ons wijst

wanneer een breuk begint zich te ontvouwen.
Daar is nog – steek de handen uit je mouwen! –
een doorbraak in het onderzoek vereist.";Dam Safety Concepts;https://repository.tudelft.nl/islandora/object/uuid%3A9568dc21-9c84-441f-88a5-c132a6f2a437;NL
Stadswaterwerken;"Een stad heeft meestal baat bij waterstromen.
Voor handel of gewoon voor praal en pracht.
Want wat zou Amsterdam zijn zonder grachten?
Wie kwam zonder Tiber nog naar Rome?

Maar in dat water kunnen karrenvrachten
micro-organismen samenkomen,
vaak als klimaatveranderingssymptomen,
dus wees wel op de risico’s verdacht.

Van groot belang is inventarisatie:
aan hoeveel wordt een stadsmens blootgesteld?
En is dat dan een dosis die ons schaadt?

Delfts onderzoek vergaart die informatie.
Let dus goed op, als straks uw ijsje smelt
terwijl u op een stadsstrand pootjebaadt.";Health Impact Assessment of New Urban Water Concepts ;https://repository.tudelft.nl/islandora/object/uuid%3A0e41d07b-9f44-4220-aaac-e22c73c5074a;NL
Verjongingskuur;"Wij rijden op zeer open asfaltbeton.
Die open structuur is voor auto's een zegen
omdat, als dit land wordt geteisterd door regen,
het water snel wegvloeit – zelfs bij een moesson.

Eén nadeel: zo'n zeer open weg brokkelt on-
herroepelijk af. Die erosie van wegen
gaat men nu met een soort verjongingskuur tegen –
zoals bij een vrouw in een schoonheidssalon.

Wat blijkt nu? De kuur heeft een heilzaam effect!
Het leven van ZOAB wordt meetbaar gerekt.
Helaas komt dat niet door vernieuwing van cellen.

De mortelbrug dijt weliswaar ietwat uit,
het asfalt krijgt echter géén jongere huid.
Dat hadden die vrouwen je kunnen voorspellen.";Extending the Lifespan of Porous Asphalt Concrete;https://repository.tudelft.nl/islandora/object/uuid%3Af9860e45-e28b-477b-8df9-a094b00fd703;NL
Noodhulp;"De mens is bij rampen een nietig figuur.
Maar, siddert de aarde dan stopt elk gekijf.
Gebroederlijk helpen we dan: 555,
en hulptroepen, voedsel – geen raad is te duur.

Echter, de medische apparatuur
die wij daarheen sturen redt hier menig lijf
maar blijft op een rampplek vaak buiten bedrijf.
Het is niet gebouwd voor de gammele schuur

of tent die daar dienst doet als noodhospitaal.
Een betere overdracht is cruciaal
en daarvoor is systems design je-van-het.

Ontwerp met dit doel: ieder apparaat moet
in noodsituaties ook veilig en goed
te bedienen zijn. Dan is de noodhulp gered.";Mind the gap: Designing Sustainable Healthcare In Humanitarian Aid;https://repository.tudelft.nl/islandora/object/uuid%3Afcda7795-fc49-4d04-b4ee-829d3b7fe975;NL
Appeltaart;"Hoe bak je nou een goeie appeltaart?
Je kunt daarvoor een kookboek openslaan
maar ook op internet te rade gaan
want youtube is echt ongeëvenaard.

De zoekmachine helpt je uiteraard.
Door slimme algoritmes komt spontaan
precies het juiste filmpje bovenaan:
voilá: een taart waarvan je likkebaardt.

Bij vinden is het altijd de essentie
dat je iets afweet van de zoekintentie.
Dus ga je zoekmachines programmeren

dan moet je die intenties integreren.
Mocht dan je taartbakzoektocht nóg niet slagen
dan kun je altijd nog je moeder vragen.";User Intent in Online Video Search;https://repository.tudelft.nl/islandora/object/uuid%3A79f06a17-f563-467e-ac49-aa55d33d8b0d;NL
Eigensensor;"Van te veel warmte raak je overstuur.
Een chip die te verhit raakt, expireert.
Silicium, zo blijkt nu, assisteert
bij microprocessorenlevensduur.

Je meet de snelheid waarmee door heel puur
silicium de warmte diffundeert.
De thermische vertraging etaleert
je dan heel nauwgezet de temperatuur.

Zo kan de chip dus zélf de thermometer
van zijn systeem zijn, en het is dus beter
als er silicium wordt ingebouwd.

Ook taal meet zélf haar eigen krachtenveld:
het kan dat u voor deze woorden smelt
maar evengoed laat dit sonnet u koud.";Integrated Temperature Sensors based on Heat Diffusion;https://repository.tudelft.nl/islandora/object/uuid%3Abd907442-60d2-4f76-a463-048db5d69d6a;NL
Efficiëntie;"Een zonnecel is niet echt efficiënt.
Je kunt een hoger rendement behalen
met betere conversiematerialen.
Het toverwoord? Fotoluminescent.

Wat wij tot dusver weten hieromtrent
is dat je van een foton bij spectrale
conversie energieën kunt vertalen
van hoog naar laag – dat vlak is nu verkend.

Wanneer die omzetting nu kan geschieden
in filmpjes van siliciumnitride
dan kun je die conversie integreren

met hoe de zonnecellen opereren.
Het rendement verbeter je dan iets;
dat scheelt weer geld – de zon gaat op voor niets.";Deposition of luminescent thin films for solar energy applications ;https://repository.tudelft.nl/islandora/object/uuid%3A49043973-cc06-4f6c-9d5f-50e7905517c6;NL
Vermoeiingsfysica;"Een boot moet, bij een reddingsoperatie,
vaak pijlsnel naar de plek des onheils toe.
Een zware, stalen romp is dus taboe;
men kiest een aluminium formatie.

Maar snelheid leidt ook snel tot irritatie
en net als mensen wordt metaal dan moe.
Dan scheurt de romp dus, en de vraag is: hoe?
Wat blijkt: er is een één-op-één relatie

met hoe de romp gelast is, want wat vaststaat:
een scheur loopt langs of loodrecht op de lasnaad.
Je kunt voorspellen hoe het zal gebeuren.

Met hulp van de vermoeiingsfysica
gaan fysici dus onvermoeibaar na
hoe lang de speedboot nog kan blijven scheuren.";Fatigue resistance of welded joints in aluminium high-speed craft: A total stress concept;https://repository.tudelft.nl/islandora/object/uuid%3A370b3d44-f4a6-403e-9629-d36174c3aca4;NL
Hoe groeit een stad?;"Hoe groeit een stad? Door simpel uit te breiden
totdat een wijdvertakt conglomeraat
zowat het ganse ommeland beslaat?
Ten dele slechts, want in de loop der tijden

wordt ook gesloopt, opdat iets nieuws ontstaat.
Een stad is een proces. Je moet je bij de
opbouw dus al grondig voorbereiden
op de verandering die komen gaat.

Maar wat verdwijnt, en wat heeft eeuwig waarde?
Een vraag die al zo oud is als de aarde;
wat schoonheid is, dat zal de tijd ons leren.

Wie weet gaat ooit de grachtengordel plat
en zie je straks, ver van de binnenstad,
Japanners Bijlmerflats fotograferen.";Wenken voor een veranderbare stad: Een studie naar veranderingspatronen van Amsterdamse buurten en bouwblokken;https://repository.tudelft.nl/islandora/object/uuid%3A392741c8-784e-4ad1-82fd-d2cb3d67f4b8;NL
Daar zit muziek in!;"Niets is zo veelzijdig als muziek.
Bijna eindeloos zijn de facetten
waar de musici op kunnen letten:
aanslag, instrumentkeus, klanktechniek…

Wat doet elke keus met het publiek?
Als je Bach vertolkt in strijkkwartetten
klinkt het anders dan met castagnetten.
Toch zijn beide keuzes artistiek.

Kun je een etude of toccata
omzetten in muzikale data
zodat vergelijken daarvan gaat?

Ja, bewijst dit proefschrift! Lees dus nu die
resultaten in een kloeke studie –
uiteraard mét notenapparaat.";Multifaceted Approaches to Music Information Retrieval;https://repository.tudelft.nl/islandora/object/uuid%3Ae8a04372-4c55-4b5f-9bc3-aaab73fe649d;NL
Kedeng Kedeng;"Het spoor is onderhevig aan slijtage.
En ook al rijdt een trein horizontaal;
belasting van het spoor is verticaal:
de bielzen voelen iedere passage.

De reiziger wil graag een bon voyage.
Wij onderzoeken dus hoe goed het staal
de trillingen op mi- en macroschaal
verwerkt – dit ter voorkoming van ravage.

Door vele hamerexcitatieproeven
weet men hoe wissels, dwarsliggers en schroeven
aftakelen – niet goed voor het comfort.

Het baanvak heeft van treinen flink te lijden.
Dus als die krengen weer een keer niet rijden
bedenk dan: dat is wél goed voor het spoor.";Vertical railway track dynamics: From measurements to numerical modelling;https://repository.tudelft.nl/islandora/object/uuid%3A0997d21a-bc6e-43bc-8a0c-55341c65e3ce;NL
Wij leven van de wind;"Wij leven van de wind, leert een gezang
dat deel is van het liedboek voor de kerken.
Dat lied laat zich niet tot geloof beperken,
want ook bij energie is wind in zwang.

Je ziet in een windmolenwiekengang
meestal drie bladen. Toch is er een sterke
interesse om met twee bladen te werken:
die draaien sneller, dus goedkoper. Lang

bestonden er esthetische bezwaren,
maar onderzoek bedwong de felste maren.
Met lineaire bladhoekregeling

gaat windwinning nog beter dan het ging.
Zo wint dat kerklied over wind aan strekking
en spreken wij van energie-opwekking.";Control Design for Two-Bladed Wind Turbines;https://repository.tudelft.nl/islandora/object/uuid%3Aabb59ca8-877a-4599-8ea9-6f23c46d39b9;NL
;;;;
;;;;
;;;;
;;;;
;;;;
;;;;
;;;;
;;;;
;;;;
;;;;
;;;;
;;;;
;;;;
;;;;
;;;;
;;;;
;;;;
;;;;
